title,author,time,url,context
Bad Religion Couldn't Let This Election Go by Without a Politically Charged Tour,L.A. Weekly, ,http://www.laweekly.com/music/bad-religion-couldnt-let-this-election-go-by-without-a-politically-charged-tour-7521015," L.A. punk band Bad Religion has always been known for its socio-political lyrics, openly questioning authority at any opportunity. That’s the band’s bag; super-sweet melodies contrasting with Greg Graffin’s deadpan delivery, dressed up with often deceptively intelligent lyrics. So just imagine what the guys are making of the current political landscape as we charge towards the end of the most divisive and hate-filled presidential campaign in recent U.S. history. “The election cycle just started getting so bizarre that I called everybody and said that we need to go out on the road,” says Jay Bentley, bassist and co-founding member. “We can’t just sit by and let this happen without at least having some sort of vent.” So Bad Religion has joined forces with Against Me! and Dave Hause of The Loved Ones for the Vox Populi tour, which hits L.A. at the Hollywood Palladium on Nov. 4, just four days before the election. The aim, according to Bentley, is to get people involved in the political process who just don’t seem to care anymore. “Greg [Graffin] had made an interesting statement, that some of the songs we’re playing were written years ago with the hopes that we wouldn’t have to play them anymore because the lyrical sentiment was distressing,” Bentley says. “It’s a sad statement that here we are playing some of the same songs with the same message, because nothing’s changed.” Bentley is 52 now, and most of his bandmates are in their early 50s as well. They’re not kids anymore, but the same issues that inspired them in the 1980s drive the lyrics in 2016. Related StoriesTop 20 Punk Albums in History: The Complete List Pop-Punk Pioneers the Descendents Are Back and Raging Against Middle Age “It’s about how incredibly intolerant one man can be of another,” Bentley says. “I wake up in the morning, and any sort of news item that catches your attention can inspire. I think a lot of people have thought of Bad Religion as a political band, but I’ve always thought that we’re a socio-political band. We’re not really about politics, we’re about people, and humans. What it’s like to be a human on the planet is sort of our underlying theme.” It is disheartening that Bad Religion’s early songs are still as relevant, if not more so, today as they were when they were written, but it’s also impressive that they’ve held up so well. Bentley says that was the original intention: to write songs that would have some level of credibility ever many years down the road. That those young punks had the foresight to think like that as their careers were just kicking off is admirable. Bentley says that there are plenty of other things that haven’t changed for him or his bandmates, either. “There’s part of me that has the same cathartic release on stage that I had when I was 15,” he says. “I like to scream at the top of my lungs, and I like to jump around and get lost in the moment.” The biggest difference is the amount of work that the band members feel is necessary at this point, or that they are contractually obliged to do. They’re in the rare and luxurious position where they can pick and choose their gigs, and release a song or album when they feel the inclination. Some would say that it’s the early desperation, the fire of youth, that fuels the best punk rock, but Bentley says they’re simply now able to enjoy the fruits of their labor. “Right now, the day to day process of Bad Religion is actually quite simple,” he says. “We’re all really comfortable where we are. We don’t really have any specific drive to go and do something other than things that come up that we think are important. I know that’s a weird thing for a band to be like, ‘We’re just hanging out.’ It seems like working is what a band should be doing.” On the subject of picking and choosing their projects, Bad Religion just put out the first vinyl version of the live album 30 Years Live, six years after it was first released. Why do that now? Well, why not? Upcoming Events BoomBox Tickets Thu., Oct. 27, 8:00pmKanye West Tickets Thu., Oct. 27, 8:00pmBrewfish Tickets Thu., Oct. 27, 8:30pmThe Celso Salim Band Tickets Thu., Oct. 27, 9:00pmThe Spazmatics Tickets Thu., Oct. 27, 9:00pm “Vinyl is having a resurgence and we didn’t really have a physical manifestation of it,” Bentley says. “When we did it, we said we’d do a 'best of' live album, but we wanted it to not really be the tracks that we’ve already put out on other collections. So it was a nice selection of songs that most people haven’t had the opportunity to hear live.” Whether they’re performing familiar or unfamiliar songs, Bad Religion always bring it live. And despite the fact that they don’t have to work to the degree that they once did, there’s still fire in the old bellies. The balance between “professional” and “punk rock” is always a treacherous one, but even if Bad Religion clearly know what they’re doing, don’t mistake that musical togetherness for complacency. These guys will still kick your ass from the stage, as we’ll see at the Palladium. “It is a politically driven message, and we went through the catalog and chose the songs that have important meaning,” Bentley says of their current live set. “We have political statements like ‘Man With a Mission’ or ‘You Are (The Government),’ which point at things as they are today, and we close the show with ‘Fuck Armageddon, This is Hell,’ which is us just throwing our hands up in the air and going, ‘I don’t even know what to think anymore.’” VOX POPULI TOUR: BAD RELIGION, AGAINST ME!, DAVE HAUSE| Hollywood Palladium | 6215 Sunset Blvd., Hollywood | Friday, Nov. 4, 6:30 p.m. | $61-$171 | livenation.com Bridgetown DIY Is Doing for the San Gabriel Valley What the Smell Does for Downtown L.A. (VIDEO) PREVIOUS Bridgetown DIY Is Doing for the San Gabriel Valley What the Smell Does for Downtown L.A. (VIDEO)"
Papyrus offers nonbiblical mention of Judean kingdom in Jerusalem,Religion News Service, ,http://religionnews.com/2016/10/26/papyrus-offers-nonbiblical-mention-of-judean-kingdom-in-jerusalem/,"The document is preserved in the Israel Antiquities Authority’s Dead Sea Scrolls laboratories. Photo by Shai Halevi, courtesy of the Israel Antiquities AuthorityJERUSALEM (RNS) Israeli archaeologists have unveiled the earliest known nonbiblical Hebrew-language reference to Jerusalem, dating back to the time of the First Temple in the seventh century B.C. The reference, part of a wine-shipping order, was written in ancient Hebrew on a small piece of papyrus. It reads: “From the king’s maidservant, from Na’arat, jars of wine, to Jerusalem.” Plundered from a cave in the Judean Desert (in what is today the West Bank) by antiquities robbers, the papyrus was recovered by the Israel Antiquities Authority’s robbery prevention unit, dated and analyzed. The papyrus, or scroll, like the Dead Sea Scrolls found nearby decades ago, was preserved thanks to the Judean Desert’s extremely dry climate.With the help of volunteers during the past year the Israel Antiquities Authority has been conducting an archaeological excavation in search of ancient artifacts in the Cave of the Skulls in the Judean Desert. According to Israel Hasson, director of the Israel Antiquities Authority: “Every day robbers go into the desert in order to search out and plunder ancient documents such as the papyrus that was exposed. The state has to mobilize and allocate the necessary resources in order to embark upon a historic operation together with the public, and carry out systematic excavations in all of the Judean Desert caves.” Photo by Yoli Shwartz, courtesy of the Israel Antiquities Authority“The document represents extremely rare evidence of the existence of an organized administration in the Kingdom of Judah,” said Eitan Klein, deputy director of the robbery prevention unit. “It underscores the centrality of Jerusalem as the economic capital of the kingdom in the second half of the seventh century B.C.” Klein said that according to the Hebrew Bible, any one of three kings could have been the wine’s intended recipient. Some Israeli politicians seized on the papyrus discovery, calling it ironic that at a time when archaeologists are finding artifacts made by Jews nearly 3,000 years ago in Jerusalem and other places in the ancient land of Israel, the United Nations’ world heritage organization, UNESCO, has ratified two resolutions referring to the Temple Mount — the holiest site in Judaism and the third holiest in Islam — solely by its Arabic name, with no mention of Jewish and Christian religious or historical ties. Miri Regev, Israel’s minister of culture and sport, called the papyrus “further tangible evidence” that Jerusalem “was and will remain the eternal capital of the Jewish people.” “The Temple Mount, the very heart of Jerusalem and Israel, will remain the holiest place for the Jewish people, even if UNESCO ratifies the false and unfortunate decision another 10 times,” Regev said. (Michele Chabin is RNS’ Jerusalem correspondent)Most PopularThe politics of Jen Hatmaker: Trump, Black Lives Matter, gay marriage and morePapyrus offers nonbiblical mention of Judean kingdom in Jerusalem10 predictions for the days after Nov. 8 CommentsRNS’s comments section is meant to be a place of lively yet respectful and edifying discussion of our stories and the issues they raise. For more information, see our commenting policy"
"Religion & Ethics NewsWeekly – October 28, 2016",Religion News Service, ,http://religionnews.com/2016/10/26/religion-ethics-newsweekly-october-28-2016/," Religion &amp; Ethics NewsWeeklyis a production of THIRTEEN Productions LLC for WNET. Visit www.pbs.org/religionandethicsfor additional information. Show #2009 will be fed over PBS at 5:00 p.m. EST on October 28, 2016 (check local listings). Election 2016: Candidates’ Religious Backgrounds– Hillary Clinton is a United Methodist. Donald Trump identifies himself as a Presbyterian. Tim Kaine is a Roman Catholic. And Mike Pence describes himself as “Christian, conservative and Republican—in that order.” In the next of our special election reports, Kim Lawtonexamines the religious backgrounds of the major party candidates and looks at how that influences their politics. The Meaning of Peace in the Qur’an– While an enormous amount has been written over the centuries about the Qur’an, the idea of peace in the sacred book of Islam, believed by Muslims to have been revealed to the Prophet Muhammad in 610, has been overlooked, according to University of Michigan history professor Juan Cole. We spoke with him at the Library of Congress in Washington, DC where he explained, “The Qur’an says one of the names of God is peace. If God is peace, and if the revelation of the Qur’an to Muhammad is peace, then peace is pretty central to this book.” ###ContactDonna Williams WilliamsD@wnet.org(212) 560-8030 NoticeThe organizations and/or individuals who submit materials for distribution by Religion News Service are solely responsible for the facts in and accuracy of their materials. Religion News Service will correct any errors brought to its attention.Most PopularThe politics of Jen Hatmaker: Trump, Black Lives Matter, gay marriage and morePapyrus offers nonbiblical mention of Judean kingdom in Jerusalem10 predictions for the days after Nov. 8 CommentsRNS’s comments section is meant to be a place of lively yet respectful and edifying discussion of our stories and the issues they raise. For more information, see our commenting policy"
'Denial' is the movie for the election season | Religion News Service,Religion News Service, ,http://religionnews.com/2016/10/26/denial-movie-deborah-lipstadt/," Remember that famous scenein “Seinfeld” where Mrs. Seinfeld browbeats Jerry into seeing “Schindler’s List”? “You have to see it!” For Helen Seinfeld, the act of seeing “Schindler’s List” was not mere entertainment; it was a moral, even religious, imperative. “Denial”falls into that same entertainment/moral category. It is the “must see” movie of this election season. “Denial” is the story of Emory University professor, Deborah Lipstadt, and how she was forced to defend herself in a libel trial in England. The British author, David Irving(portrayed in the film by Timothy Spall) brought the suit against her because she had called him a “Holocaust denier” in her book Denying the Holocaust. According to laws in the UK, in a libel suit, the “libeler” is considered guilty until proven innocent. The trial was long and draining — emotionally, financially, physically, and spiritually. Lipstadt was defended by the noted English barrister and scholar, Anthony Julius(who was Princess Diana’s divorce attorney, and the author of one of the best bookson anti-Semitism that I have ever read — and that says a lot), as well as Richard Rampton, brilliantly portrayed by the noted actor Tom Wilkinson. The film includes soul-searing footage in Auschwitz, as members of the legal team and their consultants visit the infamous concentration camp on a fact-finding mission. There is much to say about “ Denial.” After seeing it, I decided to re-read Deborah’s bookon the ordeal. First, I have a personal relationship with Professor Lipstadt, going back to my days in Atlanta (and even before), and I consider her one of my heroines. Rachel Weisz’s portrayal of Deborah deserves an Academy Award — if for nothing else than her perfect evocation of Deborah’s New York/Queens accent and cadence. It was a loving tribute to a marvelously impressive woman, who lived up to her biblical namesake(and the film shows Deborah also drawing inspiration from a statue of Boudica, the ancient British Celtic queen who led a rebellion against the Romans). Second, the movie alludes to one of the most important, but necessarily least known, aspects of the case (though it is more clearly described in Deborah’s book on the trial). That is the fact that significant American Jewish philanthropists, quietly but resolutely, “passed the hat” to help pay for Deborah’s defense. Here, the credit goes to the late, lamented Rabbi Herbert Friedmanof the Wexner Foundation, who told Deborah: “It’s time to get organized. Irving set his sights on you, but it’s the entire Jewish community he is aiming at.” Les Wexnermade it happen. And so did the American Jewish Committee, under the leadership of David Harris, the Anti-Defamation League, and the Simon Wiesenthal Center.The story of “Denial,” therefore, is the story of American Jews working together, behind the scenes, to pursue justice. It is also the story of how Emory University itself was a full partner in Deborah’s defense. Herb Friedman was right: this was not just Deborah’s fight; it belonged to the entire Jewish community. And third, this movie is absolutely crucial — and the timing of its release could not have been better and more pertinent. Why? Because it is about a very relevant theme that runs through American life today. What is the nature of David Irving’s ideology? Listen to the poemthat he taught his daughter — prompted by seeing black or racially-mixed children on the street: I am a Baby AryanNot Jewish or SectarianI have no plans to marry anApe or Rastafarian.Sound familiar? But, more than that: David Irving made s______ up. Yes, he was intellectually dishonest. But this dishonesty goes far beyond mere shoddiness and sloppiness. It is a dishonesty that has, at its core, sheer mendacity and hatred. The issue of making s_____ up goes far beyond David Irving and Holocaust deniers. It has fully migrated into UNESCO, which has denied the historical Jewish connection to sacred sites in Jerusalem. And, let the record note: the scenes of neo-Nazis confronting Lipstadt outside the trial are eerily reminiscent of the rise of the American alt-right. Go see the movie. And fight those tendencies within certain dark corners of American political life — that would emulate David Irving and his supporters.News Wire Subscribers: This article is not available for republication. Questions? Email wendy@religionnews.com.Most PopularThe politics of Jen Hatmaker: Trump, Black Lives Matter, gay marriage and morePapyrus offers nonbiblical mention of Judean kingdom in Jerusalem10 predictions for the days after Nov. 8 CommentsRNS’s comments section is meant to be a place of lively yet respectful and edifying discussion of our stories and the issues they raise. For more information, see our commenting policy"
Protesters burn books as Jordan reduces religion's role in schools,The National, ,http://www.thenational.ae/world/middle-east/protesters-burn-books-as-jordan-reduces-religions-role-in-schools," Related Back in parliament, the Brotherhood is treading cautiouslyJordanian writer shot dead as he arrives at court to face charge of offending IslamJordan’s crackdown on terrorism mired in doubtISIL militants have launched a losing war on JordanJordan’s stability is key for the region, UAE analysts say Topics: Jordan AMMAN // Changes to Jordan’s school curriculum, including less religious content in textbooks, is sparking controversy across the country, with the teachers union, Islamists and parent groups objecting to what they see as an attempt to alienate students from their cultural and Islamic values. Protests have taken the form of a book-burning, a vicious social media campaign and calls for the education minister to resign.The modifications, which took effect at the start of the academic year in September, include pictures of women without head covering – considered offensive to religious Muslim Jordanians.Content touching on the coexistence of religions has also been introduced and text interpreted as promoting extremist ideology removed.Those changes, made by the education ministry for the first time in a decade are part of a wider strategy to combat radical Islam in a country struggling to prevent hate crimes such as the recent murder of a prominent secular writer who was accused of offending Islam.Education minister Mohammad Thneibat said they were intended to develop the educational system and improve analytical thinking.""They focus on the values of the nation, moderation and the core values of Islam and not like some allege,"" he said.However, the Jordan teacher’s association – the country’s teachers’ union – condemned the changes, saying they were part of a conspiracy against Islamic values, seeking to create discord and to promote normalisation of relations with Israel.The union said that Islamic references were scaled-down and Arabic names replaced. For example, in one Arabic exercise, ""Fatmeh went to Mecca"" was changed to ""Samia went to Lebanon"".In third grade Arabic books, a photo of male students in a computer lab was changed to include uncovered girls in a mixed class. Another book had a cartoon of a man sweeping the floor next to his child, in an attempt to break away from traditional gender stereotyping of women.In a chemistry book for tenth-graders, a sentence beginning with ""praise be to God"" was removed.""The total number of Quranic verses went down from 261 to 44 in Arabic language books from fifth to tenth grade,"" said Ahmad Hajaya, a spokesman from the teachers’ association. ""There are hidden powers that want to normalise the curriculum and globalise it so that the next generation will kneel down [succumb] to other cultures and to the enemy as well.""The Islamic Action Front, the Muslim’s Brotherhood political arm that won eight out of 130 seats in last month’s parliamentary elections, has also criticised the changes.""The government is justifying the changes to the curricula as a development, but it is an attempt to underestimate the intelligence of Jordanians,"" said Ali Abu Al Sukkar, the deputy head of Islamic Action Front.""We believe that scrapping religious text and Ahadeeth [the prophet’s sayings] and changing the women’s Islamic image is blatantly targeting [our] religion and culture.""Education experts who had called for a moderation of the curriculum welcomed the changes but said they did not go far enough.""The changes were largely superficial and religion remained dominant,"" said Thougan Obeidat, 74, a former deputy secretary general at the education ministry.""The issue of a woman without a head cover is blown out of proportion. She mostly appears as a cartoon and sitting with her family, so she does not need to be wearing one.""Defending the changes, he said the earlier editions of the textbooks did not even mention that there were Christians in Jordan, and included sentences that promoted extremism, or were derogatory to women. He said the new textbooks redress those imbalances.""For the first time [now], you see a church next to a mosque in the civic education books. The image of women has also improved,"" he said. Mr Obeidat said he had received death threats on social media in recent weeks because he has advocated that religious text does not need to be emphasised in all textbooks since there are already books on religion.""The students would end up studying religion in religion books, in Arabic books and civic education books and even science books,"" he said.Last month, protesters demonstrated outside the education ministry, burning textbooks and demanding that Mr Thneibat step down as education minister.Mr Thneibat said earlier this month that those who opposed the changes had based their facts on rumours and hearsay. The images and texts circulating on social media had either been doctored or taken from non-Jordanian school textbooks, he said, and did not appear in the new books.""There’s a large-scale negative campaign against the adjustment. The new school curriculum is not intended to alienate Islam,"" said the minister. Rather, it ""seeks to instil true Islamic values in the students"".Earlier this week, the union’s Mr Hajaya presented a list of their concerns to the education minister, citing examples of what the association would like to see. Among them is an Arabic passage about the benefits of swimming which the association insists should include Islamic references.For his part, Mr Thneibat insisted the teachers’ association had nothing to worry about. ""The ministry will not allow any sentence or phrase that stands against Islamic and national values,"" he said. ""We will address this if we find any,"" foreign.desk@thenational.aePages: Add your comment View all commentsRelatedBack in parliament, the Brotherhood is treading cautiously Jordanian writer shot dead as he arrives at court to face charge of offending Islam Jordan’s crackdown on terrorism mired in doubt ISIL militants have launched a losing war on JordanMore Middle East and North Africa Russia denies bombing school in Syria as UN calls for probe US and coalition ‘intercept four weapons shipments from Iran to Yemen’ Two Yazidi women awarded EU’s Sakharov human rights prize Up to 900 ISIL fighters killed in Mosul battle, US says MOST VIEWEDWorld | All From chai-wala to fashion wala for Pakistan’s blue-eyed boyProtesters burn books as Jordan reduces religion’s role in schoolsIraqi priests resurrect cross in Christian town nearly recaptured from ISILUp to 900 ISIL fighters killed in Mosul battle, US saysUS and coalition ‘intercept four weapons shipments from Iran to Yemen’Russia denies bombing school in Syria as UN calls for probeISIL extremists ‘shave beards’ as pressure builds on MosulOnce deemed a ‘monster’, Argentine teacher with Down syndrome is now an inspirationIn Iraqi Kurdistan, little regard for Baghdad alcohol banA Pakistani chai wala’s gaze creates a window into the nation’s soulMore Most Viewed Watch: Rory McIlroy adopts Taylor Made driver, sends ball ‘flying’ in ShanghaiDubai’s Dh12.5bn tunnel project likely to start next yearHuddersfield Town: A worldly club nestled into the Pennines, finding an edge on a budgetRanbir Kapoor, Tiger Shroff and Abhishek Bachchan: the struggle of Bollywood’s ‘star kids’Abu Dhabi drivers paying hundreds of dirhams a month on car cleaning to avoid finesFilm review: The Accountant is an action-hero tale that doesn’t quite add upFrom chai-wala to fashion wala for Pakistan’s blue-eyed boyUnfair of Real Madrid fans to boo a great player like Cristiano Ronaldo, and he will prove the doubters wrongCourage key for diplomacy, serial adventurer tells UAE studentsJapanese TV sensation Midnight Diner serves up a taste of hope in an uncaring world"
