title,author,time,url,context
Few Americans identify with more than one religion,Pew Research Center, ,http://www.pewresearch.org/fact-tank/2016/10/26/few-americans-identify-with-more-than-one-religion/," While the number of Americans who were raised in homes where parents had different religions appears to be growing, relatively few think of themselves as having been brought up in more than one religion, and even fewer say they currentlybelong to multiple religions.Roughly one-in-five American adults say they were raised by two people with different religious identities â such as a mother who was a Catholic and a father who was a Protestant, or a mother who was Jewish and a stepfather who was religiously unaffiliated â according to the newest report on our Religious Landscape Study. But only about half as many (11%) say they think of themselves as having been raised in more than one religion. And just 6% say they now identify with multiple religions.Young U.S. adults are considerably more likely than older Americans to report having been raised by two people with different religions. But this trend so far has not produced a discernible increase in the number of Americans who hold multiple religious identities. Adults ages 18 to 29 are no more likely than older adults to say they think of themselves as having been brought up in more than one religion. And there is no difference across age groups in the share who say they think of themselves as currentlybelonging to multiple religions.People who say they think of themselves as having been raised in more than one religion are more likely than others to identify with multiple religions as an adult. But still, only 15% of those who say they were raised in multiple religions now say they belong to more than one religion. The standard religious affiliation questionon Pew Research Center surveys does not explicitly ask respondents whether they belong to multiple faiths. In the latest study, however, we deliberately set out to explore how much religious mixing takes place in American families and whether it is on the rise. So we asked respondents a series of questions about the religion of the main people who raised them (including, in some cases, not just parents but also step-parents, grandparents, foster parents, etc.). We also asked all respondents, explicitly, whether they think of themselves as having been raised in more than one religion, or if they now belong to more than one religion. If they said yes to either question, we posed an open-ended follow-up question, asking them to explain further.Among the survey respondents who say they think of themselves as having been raised in multiple faiths, nearly half (49% of this group, about 6% of all U.S. adults) say this means they were exposed to more than one religion, often through family members of different backgrounds. An additional three-in-ten (28%) say it means they practiced multiple faiths at one time, including by attending multiple houses of worship or observing holidays or other elements of more than one religion, such as celebrating both Christmas and Hanukkah. A smaller share (18%) say their family switched religions or churches, practicing first one faith, then another.A large share of the 6% of U.S. adults who say they currently think of themselves as belonging to more than one faith (57% of this group, or about 3% of all U.S. adults) explain that they actually practice or believe in multiple faiths at the same time. Specific explanations people in this category give include taking the view that all religions are essentially the same and attending different kinds of houses of worship. Fewer say their blended religious identity is due to changing religions or churches or to having family members of different religions."
"The politics of Jen Hatmaker: Trump, Black Lives Matter, gay marriage and more",Religion News Service, ,http://religionnews.com/2016/10/25/the-politics-of-jen-hatmaker-trump-black-lives-matter-gay-marriage-and-more/," Jen Hatmaker says her first political memory is of being at a church service and finding a voters guide in her bulletin. The pamphlet did not strike her as odd or off-putting, despite encouraging congregants to “vote straight-ticket Republican.” As she says: “The way it had always been explained to me was the Republican platform is Christian. The end.” But much has changed since Hatmaker’s childhood in blue-collar suburban Wichita, Kan. The evangelical movement in which she was raised has become more politically diverse and less willing to overtly align with one party. And Hatmaker has changed, too. She has voiced strong political opinions on her Facebook page and took time during her multicity “ Belong Tour” to criticize Donald Trump. Here, we discuss her political views, and Hatmaker does not hold back. The interview was edited for length and clarity. You said you grew up in a Republican Christian context, but what about today? Do you consider yourself a conservative or a liberal? The most honest answer is probably that I am a left-leaning moderate. I have voted for Republican candidates, I have voted for Democratic candidates. I never vote a straight ticket, ever, in any election. Speaking of voting, you’ve been critical of Donald Trump. What is it about him that bothers you as a Christian woman? I hardly know where to start. I find him absolutely, positively, thoroughly unfit for the presidency. He does not understand politics, he does not understand policy, he does not understand the world, he does not understand how our government works. I don’t believe that he has America’s best interests at heart. He lacks the diplomacy that is required of a United States president. I cannot imagine any scenario in which he could represent the American people on an international stage with any sense of integrity or diplomacy. As a believer, I’m devastated at how successful he has been in pandering to our lowest, basest selves. The selves that are willing to be openly racist. The selves that are afraid of anybody that does not fit our demographic. The selves that close our arms and our hearts to victims and vulnerable people. He has exposed the darkest corners of our human hearts and then given them free rein to live out in the open. That scares me. Then of course there’s all the low-hanging fruit that we find in the media almost every other second. His history with women and his disturbing comments. They’re not just unpresidential, they’re disgraceful. They’re disgraceful for my seventh-grader. These are not OK. Image courtesy of Thomas NelsonWho do you plan to vote for? My initial thought is vote for whoever is not Donald Trump and can win. It’s interesting, though, to watch Evan McMullin rise up right now as a conservative candidate, and I’m paying attention to that. I like him. I think he’s got a lot of integrity, and I like his policies. What about Hillary? Would you be open to voting for her? Yes. But Hillary has her share of problems too, right? That to me is where the Christian family is struggling right now, because in terms of character assassination, both of our candidates have some dirt. It has become a matter of which is worse, and it’s a terrible predicament. Politically speaking, do you support gay marriage? From a civil rights and civil liberties side and from just a human being side, any two adults have the right to choose who they want to love. And they should be afforded the same legal protections as any of us. I would never wish anything less for my gay friends. From a spiritual perspective, since gay marriage is legal in all 50 states, our communities have plenty of gay couples who, just like the rest of us, need marriage support and parenting help and Christian community. They are either going to find those resources in the church or they are not. Not only are these our neighbors and friends, but they are brothers and sisters in Christ. They are adopted into the same family as the rest of us, and the church hasn’t treated the LGBT community like family. We have to do better. If an LGBT friend of yours got married, would you attend that wedding? I would attend that wedding with gladness, and I would drink champagne. I want the very best for my gay friends. I want love and happiness and faithfulness and commitment and community. Yes. That’s an easy answer.Jen and her family starred in “My Big Family Renovation” on HGTV.  Image courtesy of Jen HatmakerAnd how would you respond if one of your children were gay? I think we would parent that child exactly the same as the rest of them. Which is to say, we would always be on their side and in their corner and for them and with them. We want for all of our kids the same thing: faithful, committed marriage and a beautiful family that is committed to God and the church. I would have the same standard across the board, no matter what. You mention faithfulness and God. Do you think an LGBT relationship can be holy? I do. And my views here are tender. This is a very nuanced conversation, and it’s hard to nail down in one sitting. I’ve seen too much pain and rejection at the intersection of the gay community and the church. Every believer that witnesses that much overwhelming sorrow should be tender enough to do some hard work here. What about that other hot-button issue? Where do you stand on abortion? I’ve always had a pro-life ethic and still do. But my pro-life ethic has infinitely expanded from just simply being anti-abortion. For me, pro-life includes the life of the struggling single mom who decides to have that kid and they’re poor. It means being pro-refugee. It means being pro-Muslim. My pro-life ethic, while still not in favor of abortion and certainly not in favor of late-term abortions, has expanded. There’s something incredibly disingenuous about a Christian community that screams about abortion, but then refuses to support the very programs that are going to stabilize vulnerable, economically fragile families that decide to keep their kids. Some Christians want the baby born, but then don’t want to help the mama raise that baby. We don’t want to provide the scaffolding for them to thrive and be successful. That, to me, makes no sense at all. You’re a mother of a multiethnic family. What are your thoughts on Black Lives Matter? I’m a supporter of Black Lives Matter, and I am deeply embedded in that conversation. I am learning so much from people of color right now, specifically my black mentors and leaders that I’ve sort of put myself under. This was not a topic I even considered 10 years ago. But now I’ve read devastating books like “The New Jim Crow”by Michelle Alexander. It’s shattering, that piece of work. Brandon and I went down to Montgomery and sat for two days under the leadership of Bryan Stevenson, who wrote “Just Mercy,”and we learned so much from a legal standpoint. This conversation is wrought with tension. But I feel like this is a big part of my task and work, probably forever. As a mother of children of color, do you fear for your children? Yes. Both of my youngest two kids are Ethiopian.I can’t tell you how many nights I have stayed up worrying, because right now, my son Ben is 13. He’s adorable. Everybody loves him. He’s funny. He’s little, and he’s not threatening, but in four years he’s going to be 17. Right now, he is afforded covering by white parents. He borrows from our privilege because we are a package deal, but in a blink he’ll be walking around this world on his own. My son is good to the core. When I think about him being viewed as criminal, dangerous, threatening, in any scenario — driving, walking, changing lanes, hanging around with his friends — I could just come unraveled. It terrifies me. I could cry my eyes out right now. With great sorrow, we have sat down and had the talk with Ben that millions of black parents have had with their sons on how to walk and talk and respond to a police officer. Because all evidence and documented research tells me that he is far more at risk to be stopped, to be pulled over, to be frisked, to be searched, to be charged, to be manhandled, to be indicted, to be sentenced. It just terrifies me for my family and for all moms and all dads who are sending their black kids out into the world. (Jonathan Merritt is senior columnist for RNS and a contributing writer for The Atlantic)Most PopularThe politics of Jen Hatmaker: Trump, Black Lives Matter, gay marriage and morePapyrus offers nonbiblical mention of Judean kingdom in Jerusalem10 predictions for the days after Nov. 8 CommentsRNS’s comments section is meant to be a place of lively yet respectful and edifying discussion of our stories and the issues they raise. For more information, see our commenting policy. Get RNS in your inbox Sign upMore by Jonathan MerrittYou don't have any recent stories.‘JESUS IS BETTER THAN YOU IMAGINED’About Jonathan Merritt Jonathan Merritt is senior columnist for Religion News Service and a contributing writer for The Atlantic. He has published more than 2500 articles in outlets like USA Today, The Week, Buzzfeed and National Journal. Jonathan is author of ""Jesus is Better Than You Imagined"" and ""A Faith of Our Own: Following Jesus Beyond the Culture Wars."" He resides in Brooklyn, NY."
CPI(M) to intervene in SC hearing on use of religion in polls | The ...,The Indian Express, ,http://indianexpress.com/article/india/india-news-india/cpim-to-intervene-in-supreme-court-hearing-on-use-of-religion-in-polls-3105740/," CPI(M) to intervene in SC hearing on use of religion in polls CPI(M) to intervene in SC hearing on use of religion in pollsThe apex court had on Wednesday raised the question whether seeking of votes on the basis of religion, caste or tribe would amount to ""corrupt practice"" under the election law. By: PTI New DelhiPublished:Oct 27, 2016, 17:37indiaFingers crossed, security up, Ae Dil Hai Mushkil releases todayHaryana sacks 53 health workers on strikeRelated VideosThe Royal Opera House Reopens After Decades Of Neglect: Here’s A Quick TourTata Sons Rubbishes Cyrus Mistry’s Allegations: Here’s What HappenedPakistan High Commissioner denies allegations leveled on his staffer for espionage activitiesOdisha: Villagers Refuse To Cremate Dalit Woman’s Body By: PTI| New Delhi | Published:October 27, 2016 5:37 pmSupreme Court of India.The CPI(M) on Thursday became the first political party to intervene in the ongoing Supreme Court hearing on whether seeking votes in the name of religion or caste amounted to “corrupt practices” under the Representation of the People’s (RP) Act. The party filed an application for intervention, through its General Secretary Sitaram Yechury, saying it was an interested party in the case as it had considerable stake in the democratic electoral process of the country. The case is being heard by a seven-member Constitution bench. Watch What Else Is Making News“It is respectfully submitted that since this Court is considering the interpretation of Section 123(3) and (3A) of the Representation of People’s Act, the applicant, which actively participates in democratic process of this country, is seeking kind indulgence of this Court to present its views in the interest of justice,” the petition said.“The applicant herein is an interested party in the civil appeal as it has a considerable stake in the democratic elctoral process of this country,” it said.The CPI(M), in its plea, also submitted that it believed in secularism and quoted its Programme saying it was committed to wage an “uncompromising struggle” for the consistent implementation of the principles of secularism.“While defending the right of every religious community -whether it is the majority or the minorities, as well as those who have no faith in any religion to believe in and practice any religion or none at all, the Party should fight against all forms of intrusion of religion in the economic, political and administrative life of the nation and uphold secular and democratic values in culture, education and society,” the plea quoted the Party Programme as saying.The apex court had on Wednesday raised the question whether seeking of votes on the basis of religion, caste or tribe would amount to “corrupt practice” under the election law.In its petition to the apex court, the CPI(M) said “the threat to the secular foundations has become menacing with the rise of the communal and fascistic RSS-led combine and its assuming power at the Centre. Systematic efforts are on to communalise the institutions of the state, the administration, the educational system and the media.”The CPI(M) said “the growth of majority communalism will strengthen the forces of minority communalism and endanger national unity” and is fraught with serious consequenses for democracy and secularism in the country. Social activist Teesta Setalvad had earlier sought to intervene in the matter with an application stating that religion and politics should not be mixed and a direction be passed to de-link religion from politics. Best of Express India It’s spy vs spy: India, Pakistan expel a mission staffer each within hoursIndia Pakistan espionage case: Seized ID card has right address, wrong areaIndia Wanted to hit LeT camps in Pakistan after 26/11 strike: Shivshankar MenonIndia BJP states to SC: Religion part of society, can’t spell out dos and don’ts of poll manifestosIndia Arrested for sedition, J&amp;K youth gets bail, ‘motherland’ reminderEntertainment Shivaay movie review: This is Ajay Devgn's show all the wayEntertainment KRK leaks Ajay Devgn's Shivaay opening scene, reveals plot detailsEntertainment Who is Salman Khan’s bodyguard Shera: Past, present and futureEntertainment Ae Dil Hai Mushkil vs Shivaay: How the films stack up against each otherMust Read Sports Buzz before the storm, cyclone Kyant dampen spiritSports A few DDCA officials scuttling season: Justice MudgalSports Let Dhoni play at number four: GangulyTechnology New Apple MacBook Pro has Touch Bar, here is what it will cost in IndiaTechnology Apple MacBook Pro launch live: Apple kills the Fn key with the TouchBarTechnology Microsoft announces updated Surface Book with 16-hour battery at $2,399Lifestyle Bullied for her dark skin, this 19-yr-old Senegalese girl is now a much-loved model Oct 28:Latest NewsHaryana sacks 53 health workers on strike 06:20 am, Oct 28, 2016Bird flu enters Punjab for the first time 06:12 am, Oct 28, 2016Surgical strike part of Gujarat government’s special play 06:06 am, Oct 28, 2016MP to probe bags marked ‘SC/ST scheme’ 06:05 am, Oct 28, 2016Govt lied about Bastar encounter, says Congress"
Man accused of 'disrespecting religion' at airport cleared of blasphemy charge,The National, ,http://www.thenational.ae/uae/man-accused-of-disrespecting-religion-at-airport-cleared-of-blasphemy-charge," Related Drunk man ‘disrespected religion’ while boarding plane in Dubai DUBAI // A man from Saudi Arabia who was accused of ""disrespecting religion"" while trying to board a plane when drunk was found not guilty by Dubai Criminal Court.On January 14 at about 10pm police were contacted by a Moroccan who works at the boarding counter in Terminal 2 at Dubai International Airport.""He came to me asking for a boarding pass and he was completely drunk, so I told him he could not get on the plane in this condition and asked him politely to grab a cup of coffee at the cafe,"" said the 45-year-old customer service agent.About five minutes later the man returned but was still drunk, so the agent asked him to drink more coffee before boarding.""He suddenly hit me on the waist then showered me with insults before he used foul language to talk about God,"" said the airport employee, who called police.The Moroccan later dropped charges against the defendant who was still referred to court on a blasphemy charge. The 27-year-old denied the charge in court in July and is now. salamir@thenational.aePages: Add your comment View all comments More UAE UAE parents and psychologists sceptical on new screen time guidelines for children Abu Dhabi drivers paying hundreds of dirhams a month on car cleaning to avoid fines UAE’s moral education curriculum will ‘encourage pupils to be more respectful’ Adec to direct scholarships towards students pursuing in-demand careers MOST VIEWEDUAE | All Abu Dhabi drivers paying hundreds of dirhams a month on car cleaning to avoid finesCourage key for diplomacy, serial adventurer tells UAE studentsSharjah study on effects of breastfeeding to inform policy decisionsWoman to be deported for breaching UAE’s charity fundraising lawTourist jailed for bringing ‘cannabis lollipops’ to the UAEMan accused of ‘disrespecting religion’ at airport cleared of blasphemy chargeUAE parents and psychologists sceptical on new screen time guidelines for childrenUAE Portrait of a Nation: Campaigning dog lover really walks the walkiesAdec to direct scholarships towards students pursuing in-demand careersUAE’s moral education curriculum will ‘encourage pupils to be more respectful’More Most Viewed Watch: Rory McIlroy adopts Taylor Made driver, sends ball ‘flying’ in ShanghaiDubai’s Dh12.5bn tunnel project likely to start next yearHuddersfield Town: A worldly club nestled into the Pennines, finding an edge on a budgetRanbir Kapoor, Tiger Shroff and Abhishek Bachchan: the struggle of Bollywood’s ‘star kids’Abu Dhabi drivers paying hundreds of dirhams a month on car cleaning to avoid finesFilm review: The Accountant is an action-hero tale that doesn’t quite add upFrom chai-wala to fashion wala for Pakistan’s blue-eyed boyUnfair of Real Madrid fans to boo a great player like Cristiano Ronaldo, and he will prove the doubters wrongCourage key for diplomacy, serial adventurer tells UAE studentsJapanese TV sensation Midnight Diner serves up a taste of hope in an uncaring world"
"Shared religious beliefs in marriage important to some, but not all, married Americans",Pew Research Center, ,http://www.pewresearch.org/fact-tank/2016/10/27/shared-religious-beliefs-in-marriage-important-to-some-but-not-all-married-americans/," Shared religious beliefs in marriage important to some, but not all, married Americans By David MasciLeave a commentAt a time when American society has become less religious, many people still say shared religious beliefs are an important ingredient for marital success. But married adults point to other factors, such as shared interests and even sharing household chores, as bigger keys to a successful marriage.Nearly half of all married adults (47%) say sharing religious beliefs with one’s spouse is “very important” for a successful marriage, according to the newest reportfrom Pew Research Center’s Religious Landscape Study. Perhaps not surprisingly, nearly two-thirds of those married to someone from the samereligious tradition (64%) take this view, compared with just 24% of those married to someone who is affiliated with differentreligions and only 17% of those in marriages between one religiously affiliated spouse and one who is unaffiliated.But, overall, larger percentages of Americans rank other factors higher as key ingredients to a successful marriage. We asked respondents how important each of seven factors (including sharing religion) is to marital success. Topping the list as important for adults overall is having shared interests, a satisfying sexual relationship and sharing household chores.Indeed, compared with those who value shared religious beliefs, substantially more married people (64%) say having shared interests is very important for a successful marriage. Similarly, roughly six-in-ten married Americans (61%) say a satisfying sex life is very important. Even sharing the household chores is seen as crucial by more married people (56%) than sharing religious beliefs.Overall, a slightly smaller share of married people say having children (43%) and having adequate income (42%) are very important for success in marriage than say the same about having shared religious beliefs. Meanwhile, fewer see agreement on politics (16%) as a necessary ingredient for a good marriage – a fact that may save more than few marriages during a contentious election year (although another recent Pew Research Center surveyfound that most married Clinton and Trump supporters have spouses who share their candidate preference). Although nearly half of married Americans say shared religious beliefs are very important to a successful marriage, considerably fewer (27%) say the religion of their spouse was a very important factor in their choosing who to marry. Another 21% say their spouse’s religion was “somewhat” important in their decision to wed.Again, those who are married to someone in the same religious group are more likely than religiously intermarried people to say their spouse’s faith tradition was an important factor in their decision marry them. A majority of those married to someone of the same faith say this was a very (36%) or somewhat (26%) important element in their choice, while most of those who are married to someone with a different religious identity (including people in marriages between a religiously affiliated person and a religious “none”) say their spouse’s religion was not an important factor.Fully 84% of religious “nones” married to other religiously unaffiliated people say the faith of their spouse was unimportant to them in choosing whether to get married, which makes sense, considering that just 16% of “nones” married to other “nones” express the view that shared religious beliefs are very important to a successful marriage more generally."
