title,author,time,url,context
Tom Cruise: Scientology is 'a beautiful religion',The Guardian, ,https://www.theguardian.com/film/2016/oct/27/tom-cruise-scientology-is-a-beautiful-religion,"The Church of Scientology Celebrity Centre International in Los Angeles. Photograph: Getty ImagesCruise was introduced to Scientology by his ex-wife, Mimi Rogers, in 1986. He has generally been reticent when talking about his beliefs, especially after the negative public reaction to his notorious 2005 interview with Matt Lauer on NBC’s Today show.He defended his stance in a 2012 interview with Playboy, saying: “What’s interesting is, if I don’t talk about my religion, if I say I’m not discussing it or different humanitarian things I’m working on, they’re like, ‘He’s avoiding it.’“If I do talk about it, it becomes, ‘Oh, he’s proselytising.’ Reviewing the whole thing and how things can be edited and misinterpreted, I decided … when I’m promoting a film, I’m not going to get caught up in anything else, and that includes all my personal things.”Going Clear: the film Scientologists don’t want you to seeRead moreScientology has come under intense scrutiny in recent years after claims of physical, psychological and sexual abuse against its followers, accusations detailed detailed in recent documentaries such as Theroux’s and Going Clear by Alex Gibney, which focused on former members of the church.The Church of Scientology and its leader, David Miscavige, deny any involvement in these sorts of abuse and instead claim that the former members were themselves guilty of abuse, and were expelled for that reason."
"BJP states to Supreme Court: Religion part of society, can't spell out dos and don'ts of poll manifestos",The Indian Express, ,http://indianexpress.com/article/india/india-news-india/bjp-states-to-apex-court-religion-part-of-society-cant-spell-out-dos-and-donts-of-poll-manifestos-3726750/," BJP states to Supreme Court: Religion part of society, can’t spell out dos and don’ts of poll manifestos BJP states to Supreme Court: Religion part of society, can’t spell out dos and don’ts of poll manifestosThe CPI(M) also intervened in the matter. The state governments said the courts cannot pre-empt, define or spell out what can be permitted in an election manifesto. Written by Utkarsh Anand New DelhiUpdated: Oct 28, 2016, 5:42indiaHaryana sacks 53 health workers on strikeBird flu enters Punjab for the first timeRelated VideosThe Royal Opera House Reopens After Decades Of Neglect: Here’s A Quick TourTata Sons Rubbishes Cyrus Mistry’s Allegations: Here’s What HappenedPakistan High Commissioner denies allegations leveled on his staffer for espionage activitiesOdisha: Villagers Refuse To Cremate Dalit Woman’s Body Written by Utkarsh Anand| New Delhi | Updated: October 28, 2016 5:42 amSupreme Court. (File Photo)THREE BJP-ruled states told the Supreme Court on Thursday that “religion is not an anathema to the Constitution” but “a part of society”, so the courts should refrain from laying down any “straitjacket standard” on what an election manifesto can or cannot contain. Additional Solicitor General Tushar Mehta, arguing for the state governments of Gujarat, Madhya Pradesh and Rajasthan, submitted before a seven-judge bench led by Chief Justice of India T S Thakur that it was not possible to separate religion from society, and hence it was “impossible” for the courts to define yardsticks in this regard. Watch What Else Is Making News“In a multi-religious country like India, due to its very uniqueness and diversity of religion, caste, community etc, ‘religion’ is not an anathema to the Constitution… Religion is a part of the society and can always be used in any sphere of society in the country, except to the extent prohibited under the Constitution or by any statutory provision,” he submitted.The state governments said the courts cannot pre-empt, define or spell out what can be permitted in an election manifesto, adding that the Election Commission and the high courts are the competent authorities to look into the issue after the election is held. “It is, therefore, impossible to lay down any straitjacket standard as to what an election manifesto should contain or should not contain,” said Mehta. He said every case would have to be judged on its own merit, to see whether it was tantamount to “corrupt practice” as stipulated under the Representation of the People Act.Contending that there was no occasion for the Constitution Bench to seek a re-interpretation of the terms “Hindutva” and “Hinduism”, Mehta said although the court was dwelling on an interpretation of the termReligion part of society, courts can’t spell out dos &amp; don’ts of poll manifestos: BJP states to SC “religion” under Section 123 of the Representation of the People Act, the same provision also stipulates that candidates should not appeal for votes on the grounds of community and language.According to Mehta, since the provision uses the composite phrase “religion, caste, community, language” while defining “corrupt practice”, there can be no justification for treating one corrupt practice as more severe than the other, only because the expression “religion” comes into play.He argued that the concept of “separation between the Church and the State” is not used to promote any particular religion, and hence, “there is no need to enlarge its scope”. The bench asked Mehta why the state governments were bothered about the use of religion and content of political speeches. Mehta said if NGOs and activists were being allowed to intervene in the matter, state governments definitely had a stake too.Meanwhile, the Bench, which is hearing a clutch of petitions relating to use of religion in political speeches and manifestos, observed that it was perhaps not possible to chart out “dos and don’ts” of political speeches.“We are not going into the permissibility of religion in political speeches. We cannot give an exhaustive listing of ‘you can say this and you cannot say that’ in political speeches,” said the bench, when senior advocate Indira Jaising, appearing for activist Teesta Setalvad, argued that a line must be drawn and religion should be kept out of politics.The CPI(M) also intervened in the matter. Representing the party, senior advocate Sanjay Hegde submitted that the party believed in secularism and quoted its programme saying it was committed to waging an uncompromising struggle for the consistent implementation of the principles of secularism.The bench, which heard various parties represented by senior lawyers including K K Venugopal, Arvind Datar, Shyam Divan, Kapil Sibal, Salman Khurshid and Indira Jaising for six days, reserved its verdict on conclusion of the arguments. Best of Express India It’s spy vs spy: India, Pakistan expel a mission staffer each within hoursIndia Pakistan espionage case: Seized ID card has right address, wrong areaIndia Wanted to hit LeT camps in Pakistan after 26/11 strike: Shivshankar MenonIndia BJP states to SC: Religion part of society, can’t spell out dos and don’ts of poll manifestosIndia Arrested for sedition, J&amp;K youth gets bail, ‘motherland’ reminderEntertainment Shivaay movie review: This is Ajay Devgn's show all the wayEntertainment KRK leaks Ajay Devgn's Shivaay opening scene, reveals plot detailsEntertainment Who is Salman Khan’s bodyguard Shera: Past, present and futureEntertainment Ae Dil Hai Mushkil vs Shivaay: How the films stack up against each otherMust Read Sports Buzz before the storm, cyclone Kyant dampen spiritSports A few DDCA officials scuttling season: Justice MudgalSports Let Dhoni play at number four: GangulyTechnology New Apple MacBook Pro has Touch Bar, here is what it will cost in IndiaTechnology Apple MacBook Pro launch live: Apple kills the Fn key with the TouchBarTechnology Microsoft announces updated Surface Book with 16-hour battery at $2,399Lifestyle Bullied for her dark skin, this 19-yr-old Senegalese girl is now a much-loved model Oct 28:Latest NewsSurgical strike part of Gujarat government’s special play 06:06 am, Oct 28, 2016MP to probe bags marked ‘SC/ST scheme’ 06:05 am, Oct 28, 2016Govt lied about Bastar encounter, says Congress 06:02 am, Oct 28, 2016Chandigarh Tourism Development Corporation lacks concrete plans to make Baithak functional 06:00 am, Oct 28, 2016Malkangiri officials to bury unclaimed bodies of Maoists"
Gender gap among Catholics as Election Day approaches,Religion News Service, ,http://religionnews.com/2016/10/27/gender-gap-among-catholics-as-election-day-approaches/," (RNS) Much has been written about the gender divide in the upcoming presidential election, but new research suggests that gap is especially wide among Catholics. Almost six in 10 (58 percent) white Catholic male voters say they would vote for GOP candidate Donald Trump compared to 38 percent of white female Catholic voters, Public Religion Research Institute reported Thursday (Oct. 27). And almost half of white Catholic women (49 percent) favor Democratic candidate Hillary Clinton while 33 percent of white Catholic men say she is their choice. Within Protestant groups of likely voters, there are narrower, but still significant, gender gaps.“The White Catholic Gender Gap.” Graphic courtesy of PRRIAmong white evangelical Protestants — the religious group that by far favors Trump — 71 percent of male voters say they support Trump compared to 60 percent of females. Within white mainline Protestantism, 54 percent of male voters favor Trump and 31 percent support Clinton. In contrast, white female mainline Protestant voters are equally divided in their support of the two candidates — at 45 percent each. While Trump is receiving sizable support from evangelicals overall, PRRI’s research shows that Clinton is receiving significant support from black Protestant (90 percent), unaffiliated (66 percent) and non-Christian (58 percent) likely voters.“The Religion Vote in the 2016 Election.” Graphic courtesy of PRRIAlmost half of white mainline Protestant voters (49 percent) favor Trump, while 39 percent support Clinton and 12 percent either favor another candidate, don’t know or refused to answer. About half of white Catholic voters (48 percent) favor Trump, with 41 percent siding with Clinton and 11 percent choosing a different response. The analysis is based on PRRI surveys from Sept. 22-Oct. 17, and has a margin of error of plus or minus 2.2. percentage points.News Wire Subscribers: This article is not available for republication. Questions? Email wendy@religionnews.com.About Adelle M. Banks Adelle M. Banks, production editor and a national reporter, joined RNS in 1995. An award-winning journalist, she previously was the religion reporter at the Orlando Sentinel and a reporter at The Providence Journal and newspapers in the upstate New York communities of Syracuse and Binghamton."
Occupy religion,Jerusalem Post Israel News, ,http://www.jpost.com/Metro/Occupy-religion-471035," Mac Haifa looks to solidify contender status Israel hosts Sweden in Davis Cup at Ramat Hasharon Revived Maccabi Tel Aviv visits Zalgiris Rivlin harvests olives in JerusalemPolitics &amp; Diplomacy Watch UN slam Israel on ‘human rights violations’ US Amb. Shapiro keeps open continued tenure under next president Bennett to Netanyahu: You have to get rid of Hazan Yazidi survivor tells her story at Israel UN event about refugeesCulture Circus fun Top 10 things to do Dance: For the love of Latin America Dance: For the love of Latin AmericaSports Mac Haifa looks to solidify contender status Israel hosts Sweden in Davis Cup at Ramat Hasharon Second straight Eurocup victory for Hapoel Jerusalem Maiden continental conquest for Mac TABusiness &amp; Innovation Australian, Israeli entrepreneurs team up to make tech for disabled MKs aim to aid kids with severe allergies in schools Hedge-fund managers gather in Tel Aviv for investment tips and charity Infants should not sleep in bed with parentsHealth &amp; Science MKs aim to aid kids with severe allergies in schools Infants should not sleep in bed with parents Can 3D printing attract terrorist hackers as Israeli research indicates? Rate of lung cancer drops for Jews, rises among Arab men IsraelEnvironment Israel, Turkey to open dialogue about natural gas export Israel to boost solar energy production Antiquities Authority building National Campus for the Archeology of Israel Inspections show pollution violations at five Haifa Bay factoriesOpinion ▼ Women should dance with Torah scrolls My word: Normalization: The real road to peace As I see it: Palestinians step up the jihad of the lie The genesis of Israel’s next economic and moral transformationMiddle East ▼ Report: ISIS 'Rambo' killed in battle south of Mosul Palestinian rivals, Mideast regional powers growing uneasy with Abbas Iran spy chief questioned after letting gay US politician into country US House to vote on Iran Sanctions Act renewal as soon as NovemberIran News Iran claims to have intel on Israeli-Saudi plot to stir unrest in country Two American citizens sentenced by Iran to 10 years in jail Just the facts: Iran's uranium enrichment and its nuclear potential Report: Mobile phone service approved between Iran and USISIS Threat Analysis: Which Iraq will triumph in Mosul? JPost on the frontline: Iraqi army retakes Christian towns as Mosul battle rages Sinai: 150 ISIS militants wounded, killed in Egyptian air strikes Hundreds near Mosul sent to hospital after sulfur plant set alightDiaspora ▼ Parisian Jews protest France’s UNESCO vote J Street prepares for shift in approach under Clinton Campus communicators come through Baroness Tonge quits Lib Dems over anti-Semitism rowIsraeli-Innovation ▼ Rio de Janeiro and Waze join forces to tackle Brazilian traffic Impact Investment: The key to a thriving Israeli life science industry De-know-polization ‘Tell us how you made Israel’US Elections ▼ Is Trump reversing the gains Republicans have made among American Jews? The coming shift: Hillary Clinton's plans for Israel and Iran Trump advisor on Israel denies antisemitic sentiment among supporters Trump says Clinton policy on Syria would lead to World War ThreeHillary Clinton The coming shift: Hillary Clinton's plans for Israel and Iran A 32-year-old Jewish billionaire tops Clinton donor roll US State Dept official 'pressured' FBI to declassify Clinton email -FBI documents Peres was a man of psalms, Clinton saysDonald Trump Trump says Clinton policy on Syria would lead to World War Three Trump's son says he will accept ""fair"" US election Jewish Americans have a moral imperative to oppose Trump, Bill Clinton says American Israelis casting their ballots for TrumpNot Just News ▼ Star Catcher: Astrology for the week of October 28, 2016 Metro Grapevine: Gift of life Jerusalem Grapevine: Dance benefit Parashat Bereshit: Perfection, blessing and holinessPodcast Podcast: Does Trump love Jews or embolden antisemitic voices? Why Starbucks failed in Israel (and only in Israel) Taxicab Diplomacy: Trump vs. Clinton PODCAST: After Turkey, Africa and Egypt, is Saudi Arabia Israel’s next ally?Snack Bites Oh snap: Saudi groom divorces new bride for using Snapchat Malaysia to ban 'hot dogs' for sounding unislamic Star Catcher: Astrology for the week of October 14, 2016 Star Catcher: Astrology for the week of October 7, 2016"
Harvey Cox seconds Pope Francis on capitalist critique,Religion News Service, ,http://religionnews.com/2016/10/27/harvey-cox-seconds-pope-francis-on-capitalist-critique/,"Harvard Divinity School Professor Emeritus Harvey Cox wrote “The Market as God.” He is seen inside his home in Cambridge at Harvard University. Photo by Kris Snibbe/Harvard Staff PhotographerVATICAN CITY (RNS) In another step forward for Catholic-Protestant reconciliation, Pope Francis and one of America’s leading Protestant theologians agree on a major heresy: the worship of the free market. When Harvard Divinity School Professor Emeritus Harvey Cox arrived recently in Rome, he made a fast track to the Vatican to meet Pope Francis, the leader of the world’s 1.3 billion Catholics. “I was ushered to the first row of seats 15 feet from the pope’s chair,” Cox told RNS. “It was wonderful.“The Market as God,” by Harvey Cox. Photo courtesy of Harvard Divinity School“I spoke to him in Spanish. He said thank you, smiled and shook my hand.” Cox said he handed Francis a copy of his latest book, “The Market as God,” at the pope’s weekly Wednesday audience. In 2013, Francis provoked an outcry from economic conservatives with the release of his apostolic exhortation, “Evangelii Gaudium (The Joy of the Gospel),” which was widely seen as his personal manifesto. In it, Francis said the world could no longer trust “the unseen forces and the invisible hand of the market” and called for ecclesiastical renewal and compassion for the poor. Cox, who taught at Harvard for 50 years, dedicated his latest book to the pope because they share a concern about what Francis called a “deified market” that’s creating “new idols.” “This is a counterfeit religion, a heresy as opposed to traditional religion,” Cox, 87, said in Rome. “I am a Baptist, and I see this as a kind of a threat and so does the pope. “In the last 40 to 50 years the market has assumed a larger and more commanding role in our culture. It has reached an overwhelming position. It wasn’t always deified. “It was a voice in the choir, part of the culture. It was surrounded by families, communities and the nation. I’m not talking about abolishing the market, but it has escalated to a controlling level.” Cox’s visit was arranged by the Rev. Tony Currer from the Vatican body responsible for promoting Christian unity, and Cox called his encounter with the pope a kind of ecumenical breakthrough. Cox had begun writing notes for his book when he was inspired by the pope’s perspective on consumerism. “The market is enormously powerful,” Cox said. “With TV and hand-held devices, well-designed images go right inside people to their emotional center. The market also knows how to ransack religious vocabulary with products labeled ‘hope’ or ‘revelation.’ If you can relate your product to a yearning or search, it is going to make a connection.” Cox said many young Americans sense there is something wrong with the free-market system. He said they were looking for change and that is why so many were drawn to Bernie Sanders in his bid for the Democratic presidential nomination. The professor also predicted the religious right would play no decisive role in the outcome of the U.S. presidential election. “The Republican Party was always an unlikely coalition between the religious right and the country club set or upper echelon of the business community. It has fallen apart.” But Cox stressed that many people – particularly white males — who supported Donald Trump were just as disillusioned with the market as young people and wanted change. “There is something terribly wrong with how the system is functioning,” Cox said. “We still don’t have any persuasive vision. We are ready for that.” About Josephine McKenna Josephine McKenna has more than 30 years' experience in print, broadcast and interactive media. Based in Rome since 2007, she covered the resignation of Pope Benedict XVI and election of Pope Francis and canonizations of their predecessors. Now she covers all things Vatican for RNS. More by Josephine Most PopularThe politics of Jen Hatmaker: Trump, Black Lives Matter, gay marriage and morePapyrus offers nonbiblical mention of Judean kingdom in Jerusalem10 predictions for the days after Nov. 8 CommentsRNS’s comments section is meant to be a place of lively yet respectful and edifying discussion of our stories and the issues they raise. For more information, see our commenting policy"
Secularism not aloofness to religion: SC - Times of India,Times of India, ,http://timesofindia.indiatimes.com/india/Secularism-not-aloofness-to-religion-SC/articleshow/55102751.cms,"Amid a high-voltage legal debate on curbing use of religion to seek votes, the Supreme Court asked on Thursday whether secularism meant complete separation of politics from religion and said it would attempt to give a pragmatic interpretation of the law dealing with using religion and caste to promote hatred during elections.| TNN | Updated: Oct 28, 2016, 00:46 ISTNEW DELHI: Amid a high-voltage legal debate on curbing use of religion to seek votes, the Supreme Court asked on Thursday whether secularism meant complete separation of politics from religion and said it would attempt to give a pragmatic interpretation of the law dealing with using religion and caste to promote hatred during elections. ""It will be difficult to accept as a proposition that a political party should have nothing to do with religion and those who have something to do with it must cease to be political parties. Can a particular political party not say it would assuage the hurt sentiments of a religious group? Will that amount to seeking votes in the name of religion?"" a seven-judge constitution bench of Chief Justice T SThakur and Justices Madan BLokur, S A Bobde, Adarsh K Goel, U U Lalit, D Y Chandrachud and L N Rao asked. ""Secularism does not mean aloofness to religion but giving equal treatment to every religion. Religion and caste are vital aspects of our public life. Can it be possible to completely separate religion and caste from politics?"" it asked. The SC bench reserved its verdict on the mode and manner in which a court should try an electoral malpractice committed to seek votes using religion, community, caste or language. The SC is also examining how to deal with a religious leader appealing to people to vote in a particular way. The court's remark on what constituted secularism came when senior advocate Indira Jaising, appearing for social activist Teesta Setalvad, argued that the SC should lay down guidelines on what would constitute a permissible speech during elections. When the debate got lively, the CJI-headed bench veered away by declaring that the task before it was not to answer or lay down guidelines on what would be a permissible speech. ""We will answer the reference for interpretation of Section 123 as well as the interplay between Sections 98 and 99 of Representation of the People Act and nothing more,"" it said. Appearing for former MP CM Sunderlal Patwa, senior advocate Shyam Divan laid bare the thin dividing line between religion, language, caste and politics in India. He read out from the constituent charter of Shiromani Akali Dal and Indian Union Muslim League to show that these parties explicitly said their basis was to further the interest of a particular religious group."
MONTGOMERY: School board approves revisions to policy on religion,Packet Online, ,http://www.centraljersey.com/news/montgomery-school-board-approves-revisions-to-policy-on-religion/article_f53a773c-9c51-11e6-bfac-67270f2854cb.html," MONTGOMERY — Prayer during classroom time, as well as organized prayer groups, will be allowed in the Montgomery Township Public School District, following the school board’s approval of revisions to the school district policy that addresses religion in public schools. The Montgomery Township Board of Education approved the revised policy at its Oct. 18 meeting. The revised policy is a state-mandated policy. This policy replaces earlier versions of the policy that were adopted in 1999 and 2005. The former policies stated that “no devotional exercises or displays of a religious character will be permitted in this district, nor shall instructional activities be permitted to advance or inhibit any particular religious sect or religion generally.” But prayer in the classroom and organized prayer groups are among the activities that will be permitted in the school district — “provided the activity is consistent with current United States Supreme Court decisions regarding the relationship between government and religion,” the newly revised policy states. The policy adopted last week recognizes that students are protected by the First Amendment of the United States Constitution and by the New Jersey State Constitution, both of which ban the establishment of religion in the schools. It also acknowledges that religion is a personal matter. The policy also stipulates that school officials “will be neutral in their treatment of religion in the school district” and that they will not show favoritism or hostility regarding religious expression. “Accordingly, devotional exercises will be permitted in the district,” it states. Those “devotional exercises” include prayer during classroom time; organized prayer groups and activities; and religious expression and prayer in classroom assignments. It also includes student assemblies and extra-curricular events; prayer ant graduation and baccalaureate exercises; devotional exercises and other prayer and/or religion-related activities. “(But) the school district will not permit an activity if the activity advances or inhibits any particular religious expression that is protected by the First Amendment to the United States Constitution,” according to the newly revised policy."
